thumbnail,kml,Permitted Development Options,Description
a.jpg,single.kml,Single-storey rear extensions,Up to 8m for detached houses and up to 6m for others
b.jpg,roof.kml,Loft conversions,Must not extend beyond the original roof plane
c.jpg,porch.kml,Porches,Must be less than 3m high and less than 3m deep
d.jpg,boundary.kml,Boundary fences,Up to 2m high without planning permission
e.jpg,roof.kml,Solar panels,Allowed to be installed without planning permission under certain conditions
f.jpg,office.kml,Outbuildings,Must not cover more than 50% of the garden area
